{
  "handoff_id": "HO-P2-to-P2B",
  "from_actor": "orchestrator",
  "to_actor": "corpus-builder-subagent",
  "created_ts": "2026-07-19T14:30:00Z",
  "goal": "Complete the rule layer, then build the protected content corpus.",
  "plan_ref": "PLAN.md#phases",
  "done": [
    {
      "claim": "Rule registry populated and schema-valid.",
      "evidence_ref": "skills/stow/rules/registry.yaml"
    },
    {
      "claim": "The declared registry total matches the current records.",
      "evidence_ref": "tests/test_registry.py::test_current_records_are_primary_and_total_matches_population"
    }
  ],
  "not_done": [
    "Corpus modules are not yet authored.",
    "Verbatim corpus gate is not yet wired."
  ],
  "constraints": [
    "Committed surfaces stay source-name-free.",
    "The declared primary total must match the current record population."
  ],
  "next_action": "Author the corpus modules and wire the verbatim gate.",
  "artifacts": [
    {"path": "skills/stow/rules/registry.yaml", "role": "rule-index"},
    {"path": "PLAN.md", "role": "plan"}
  ],
  "open_risks": [
    "Corpus provenance must not leak into committed files."
  ],
  "acceptance_for_next": "Every corpus module is byte-exact and passes the gate."
}
